_id	product	title	author-id	author-name	date	rating	helpful	verified	body
R2WIDUTP222MEI	B00ESBHG3Q	Fantastico	AFN63GFGN33Y5ROLSYUUQL3FFD7Q	Alessandro Bruno	2019-04-04	5	0	True	Gioco davvero fantastico, aspettavo questo gioco da tantissimi anni, la dinamica di gioco è fantastica, diversa dai precedenti giochi, grafica mozzafiato
R2X4DLDX1FIRB6	B00ESBHG3Q	Kingdom heart	AGKHDUXTMIE7HFPGRAPYRTQ4CX5Q	Cliente Amazon	2019-01-30	5	1	True	Arrivato il giorno dopo averlo ordinato! Fantastico. Lo devo ancora provare, ma conoscendo i precedenti sarà spettacolare
R8769O5I4E4IL	B00ESBHG3Q	MAGICO	AHLBJHZDJBTH7VUTUNDUZ7YKUDBA	Cliente Amazon	2019-01-31	5	0	True	"SENZA PAROLE.
Dopo 5 ore di gioco già innamorato.
L'openening all'inizio del gioco con la canzone in collaborazione con Skrillex è qualcosa di MAGICO.
Consiglio a tutti."
R1WZC9VLICUXN4	B00ESBHG3Q	Lunga attesa	AHRF2K3BX3PJRYMFU6UMPKSHSK6A	Daniele	2019-01-29	5	1	True	Finalmente il tanto atteso kingdom hearts è uscito, fantastico!
R5NG73QVZNBRD	B00ESBHG3Q	Fantastico	AENKGH5376CNCUYWGITNGODACNSA	Cliente Amazon	2019-02-27	5	0	True	Perfetto imballaggio e tempi. gioco bellissimo consiglio di prenderlo in coppia con i final mix per recuperare i vecchi capitoli
R1TM7NJ43PHYAC	B00ESBHG3Q	Fantastico, da comprare	AFNA6J2CCUS4LKKHW4OYMQIIOX5A	Roberto brandoli	2019-02-19	5	0	True	Ottimo gioco, finalmente dopo tanti anni è uscito, è molto lungo, consigliato
R19ARRL75DY192	B00ESBHG3Q	stupendo	AE3LI3UD6NXQ7LH76PTRGFOBSNCQ	D.D	2019-02-17	5	0	True	una attesa che ne valsa la pena. Come sempre l'ordine e arrivato puntuale e in ottime condizioni
R64GT70579EFY	B00ESBHG3Q	ASSOLUTAMENTE DA GIOCARE	AF2Z2MARKYQJNOVKMDVROLBCOWAA	Tariq	2019-02-15	5	0	True	Un capolavoro di gioco bisogna provarlo almeno una volta nella vita, il consiglio che do e di informarsi su quello che è successo nella saga di Kingdom Hearts prima di giocare a questo capitolo.
R3MDFFWF55JWV8	B00ESBHG3Q	Fantastico! Spedizione velocissima!	AH7NDETN3VX72ZYTIYLLDHMGDJZA	Stefano	2019-01-29	5	1	True	Il gioco è spettacolare, lo aspettavo da un sacco di tempo! Spedizione in meno di un giorno!
R23X9AZMI9ITE6	B00ESBHG3Q	Ottima conclusione di una saga	AHWWFMUB7TMOUXTFS3LRUTQMO5FQ	Marco Cortina	2019-02-15	5	0	True	Bellissimo gioco per tutti quelli che hanno amato kh... peccato solo sia quello con meno mondi disney...
R24RNFVRLD2531	B00ESBHG3Q	È un gioco se lo vuoi prenotare è fattibile	AHR6BMWYEYADVRTCGLSBR2UE32HQ	Paolo	2019-02-09	5	0	True	Consegna in tempi previsti
R3IR7VHTFDNHAB	B00ESBHG3Q	Davvero buono	AHCEWSGJZGA235MIHAVL2YJNADAA	Catherine	2019-02-15	5	0	True	Arrivato subito!
R15274RE23YCD9	B00ESBHG3Q	Eccellente	AEML7AL7YOLEDHFQYBTEI2TBKUVQ	Cliente Amazon	2019-02-17	5	0	True	Gioco stupendo, tra i più belli che ho mai giocato. Prodotto arrivato il giorno esatto dell’uscita, addirittura verso le prime ore del mattino. Nessun difetto.
R2NX5IM9IPQV2M	B00ESBHG3Q	Gioco bellissimo!!	AFKV7OJKDC64GJCUEH3SJS74OHXQ	Francesco C.	2019-03-29	5	0	True	È un gioco fantastico, giocabilità ottima e storia lunghissima e ben articolata
RIF1CLBA6FWU8	B00ESBHG3Q	Da non perdere	AFMFUFPCHL3FXSMUGXPHZLWIALNQ	Andrea 	2019-02-18	5	0	True	"Il capitolo conclusivo di una saga perfetta!
Risponde a tutti gli interrogativi lasciati nei capitoli precedenti e ne apre di nuovi verso il futuro."
R3IO5K96KLW9PC	B00ESBHG3Q	GIOCO CONSIGLIATO...TOP	AE4T4LKBFNYYSAZRLQL5LX4FOH7Q	De Angelis Vania	2019-02-06	5	0	True	Regalo di Natale...consegnato in ritardo, vista l'uscita successiva...bellissimo gioco...
R2Q1BA9BRMHNLB	B00ESBHG3Q	Servizio Ottimo quanto il gioco	AEUZTBDIJ4LW7PGY67IOMASTQYBA	Matteo c.	2019-02-09	5	0	True	Arrivato con 4 giorni di anticipo, servizio ottimo (da parte di Amazon) niente da ridire, il gioco è arrivato in perfette condizioni, gioco bellissimo.
R2GJUXAI7OR82G	B00ESBHG3Q	Spettacolo.	AFEJAS5U4W5BTK5OJGKQJXEWRX3A	Lorenzo Di Finizio	2019-02-22	5	0	True	"Direi che inutile lasciare recensioni.
SPETTACOLO."
R248LTYWMMLTJ5	B00ESBHG3Q	Play4	AHXCHJ72PHURKMXWVD732ST5HY7Q	Cliente Amazon	2019-02-10	5	0	True	Perfetto
RQC6QL87PWKQ	B00ESBHG3Q	Ottimo acquisto!	AEXD2T4B3KKF25QFYJNBKE4OILFQ	Marco	2019-03-11	5	0	True	Ottimo acquisto!
R1ORTFG6REITW8	B00ESBHG3Q	Ottimo gioco	AHRYJJV3J3AMFEDJUJPAEV4VYXPA	Francesco Castiello	2019-03-06	5	0	True	Spedizione ok
R2EI64IMS8NM23	B00ESBHG3Q	Ottimo acquisto.	AFZYW4TPIUIP3RPMKIKRKGEM3P6A	Ilaria Fanfani	2019-04-04	5	0	True	Prodotto come da descrizione e spedizione rapida. Bellissimo gioco.
R3E4F12AZK3F6K	B00ESBHG3Q	perfetto	AHXXHET2DKYOKQLG7NIUO7BP5ZRQ	francesca	2019-01-30	5	0	True	pacco arrivato il giorno del dayone anche senza prime. gioco nuovo e perfetto.
R2CHQZ7T5W8VBR	B00ESBHG3Q	Perfezione	AF22ZEBYA54NX76B6B5K3VIFHW4A	Emin Montaspro	2019-02-03	5	1	True	Miglior gioco che una mente umana potesse concepire
R2NWPPATW5RI6U	B00ESBHG3Q	Splendido	AHDNHXDQGMXZYPPJBGITPY4V3SGA	Cliente Amazon	2019-02-15	5	0	True	Preordine arrivato con un giorno di anticipo! Titolo meraviglioso di una delle mie saghe videoludiche preferite.  Apprezzato totalmente.
R36VHJ5B3O9QG2	B00ESBHG3Q	Fantastico	AGIPI6FFJELFEMRRLYBX7PBSBFAQ	Stefano Zulian	2019-02-22	5	0	True	Dopo anni di attesa per Kingdom hearts 3 il gioco ha rispettato le aspettative. Gioco fantastico, ne varrà la pena giocarci.
R1K9KURWH2S3QB	B00ESBHG3Q	Eccezionale	AG4RAGGHNSETKE2XIWJ3PWPBNFBA	Andrea	2019-02-17	5	0	True	Eccezionale
R2NGADBR6G3JOI	B00ESBHG3Q	Semplicemente fantastico	AGI5Q4GMH7PJJX3Y7G6R7ZCWUFSQ	Saal_Goodman	2019-02-15	5	0	True	Aspettavo questo capitolo della saga da tanti anni, e posso dire che ne è valsa assolutamente la pena di aspettare!
RCQXRBMXH7QVQ	B00ESBHG3Q	Perfetto	AEDJHMDPPDEF6IPKDCLLX7PTKF4A	Capo96	2019-01-29	5	0	True	Niente da segnalare. Prodotto arrivato in perfette condizioni e nei tempi previsti. 👍🏻
RDJGMG542J0QK	B00ESBHG3Q	Uno dei migliori giochi.	AEVJX2NYLQBWW5MN5CDAQNPPW33Q	Alessandro	2019-03-20	5	0	True	Prodotto arrivato come previsto. Gioco perfetto. Nulla da aggiungere. 5 stelle.
R1K1NQTP963V31	B00ESBHG3Q	Perfetto	AEUGVPMCPFXTQTIRYQE33MIUBPWA	Emard	2019-02-28	5	0	True	Tempi di consegna rapidissimi e pacco intatto. Ottimo regalo per mio cognato che è strafelice
R2MHA7ANQUC4GD	B00ESBHG3Q	Ottimo!	AGUTC7KHRHCBXQOG654FBXXVI7XA	Cliente Amazon	2019-02-16	5	0	True	Mio nipote è rimasto contentissimo! Grazie!
R3UYT4RXTVSYYL	B00ESBHG3Q	GIOCO BELLISSIMO MA	AE3ZUBABO5OXAJDQQWMBIM63Z7UQ	Gherardo	2019-04-04	4	0	True	"Per carità gioco fantastico...
Ma porca eva comprato a 60 euro due settimane fa
Ora il 37% di meno
Ma por...."
R1HDTVUATM2CNC	B00ESBHG3Q	attenzione spediscono versioni in lingua random della custodia	AHLNFZFD5AIZOUQUKU4FJHA6MG5A	matteo pigliucci	2019-03-29	1	0	True	arrivato con custodia in inglese e restituito all'istante,ormai prendere una pal ita su Amazon si tira la monetina.
R1IJIJX5D2JJBK	B00ESBHG3Q	La degna conclusione, solo un Po troppo facile	AEZPSDR3Z35CNKXDMOHOSFJEJU2Q	Cliente Amazon	2019-02-17	5	0	True	La degna conclusione della saga durata così tanti anni, anche se ha una difficoltà molto più bassa dei capitoli precedenti
R3FCQRQ021QSHA	B00ESBHG3Q	Finalmente è arrivato	AGCDRSOO3JWGEC2CJP53SB2FGQMA	Fabian	2019-02-24	5	0	True	"Arrivato nei tempi previsto
Videogioco fantastico, immancabile per i fan della saga"
RAI419R73REID	B00ESBHG3Q	Spettacolo	AEMZZH2NU7EYPKHMU4E4UALDPD5Q	Lorenzo	2019-01-30	5	0	True	Preordinato una settimana prima e arrivato al day one. Niente da dire... GIOCONE che mi godró fino all' ultimo minuto
RGDP2V8XJXYCM	B00ESBHG3Q	The Keyblade Graveyard	AHRAUA6AU6YMFUA3IWF3V4JLDVLQ	SteveBreadThor	2019-02-24	5	0	True	13 anni di attesa e ne è valsa la pena. Da giocare per mettere la parola fine su questa Magia che è già un classico!
R1KNCBVT82M8JA	B00ESBHG3Q	Finalmente ho vissuto	AGCWRPEKRW6OERU6WRKGTTMD7QQQ	Francesco Franchi	2019-03-18	5	0	True	Ho aspettato tanto tempo ed tutto così bello e perfetto . Fan di KH non esitate
R35UZG6VN7P0K4	B00ESBHG3Q	Magnifico !	AFACWY7CUF4FLDRZLVP3W6XI46BA	Roberto R.	2019-02-12	5	0	True	Consegna impeccabile , gameplay da sogno , aspettavamo questo videogame da 14 anni !
R1PR3E79GQKHD4	B00ESBHG3Q	Il terzo capolavoro	AETZT77UPJQJ34FK7CTCZRZENOZA	Gianluca	2019-03-02	5	0	True	Come sempre un gioco magnifico peccato per l'audio solo in inglese
R5OI2Y3OY8MX3	B00ESBHG3Q	Maledette poste	AFDXPMET23VRGQSZSWVOXGSHQGNA	Mattia	2019-04-05	5	0	True	Gioco bellissimo ritorno indietro nel tempo, spedizione e arrivo in ritardo, ma va bene lo stesso
R2AL0ZZLHUFQY9	B00ESBHG3Q	Ottimi come sempre	AFZUXJUUN34A6RKBDNXGYOSXX4DA	Franco	2019-02-27	5	0	True	Bravissimi come sempre arrivato in perfetto orario,ottime condizioni bellissimo il gioco
RZN8U13BWKVF0	B00ESBHG3Q	Kh3 incontra le aspettative dei fans e new comers!	AHX6WSXB4BTUXZBKAEQFCUWBO6KA	Lukas	2019-03-18	5	0	True	Kh3 è un gioco che aspettavo da molto,credo sia un buon compromesso fra new comers e fans datati
R24CVFM9ZOJLUL	B00ESBHG3Q	Un altro pezzo di arte di nomura	AGTHQZDVO6BWBRBU342DBQDQRF3A	Bryan	2019-02-21	5	0	True	Un must da collezione. Giocatevelo e godetevelo.
R2PFNQPDVELL3W	B00ESBHG3Q	Puntualissimo e bellissimo	AGPWSVXVVI7FXWSEXGU5RQ4XIIGA	Davide M.	2019-01-30	5	0	True	Arrivato come prestabilito, in perfette condizioni, un titolo da avere assolutamente.
R23DGYWGY9OU80	B00ESBHG3Q	Semplicemente stupendo e perfetto!	AFPNQASO7ML4XWDJQZG5NZICY3NA	Francesco	2019-02-15	5	0	True	Consigliato al 1000 x 100 % specialmente a chi ama kingdom hearts ❤
R1MN34GECYZ29M	B00ESBHG3Q	Bellissimo 🥰	AGEJMAFY6MWN2HX6CKHPYCVVEJ4Q	Selene f.	2019-03-05	5	0	True	"Gioco bellissimo è come entrare nei cartoni animati
Grafica ottima da acquistare assolutamente"
R1LMW3G00PXQPK	B00ESBHG3Q	Tutto bene	AH6INYZSFLUWHUDUY7VPPHGPTSKA	Cliente Amazon	2019-04-04	5	0	True	Il mio sogno questo gioco tutto perfetto ovviamente
RQ82T4T6KKKK3	B00ESBHG3Q	bellissima storia	AHXMURTNYFKKRPZ47FCI4D44TW6Q	Cliente Amazon	2019-02-24	5	0	True	io spero esca più presto Kingdom hearts 4
R38AJ6JAYJG6SB	B00ESBHG3Q	Top	AHRRJIDKLFB5MAAJLT6JK4RGM4EA	Cliente Amazon	2019-03-27	5	0	True	Ottimo acquisto arrivato prima del previsto al prezzo minore.
R3FH70GU1LCKX3	B00ESBHG3Q	Gioco stupendo	AF52GCTAZUADK5S7JI5OAWRLPTBQ	Gianmarco	2019-03-20	5	0	True	Gioco stupendo un po' dispersivo ma rilassante
R1CI90VGWTAY5Z	B00ESBHG3Q	Kh3	AFXZQNZDBYZ4FMJWY2NI75GCJHIA	Raoul Mele	2019-01-29	5	1	True	♥️♥️♥️♥️♥️
R3FKOG90Q1V18O	B00ESBHG3Q	Meraviglioso	AE5CTUKCDRZBDIJ4P4RQS2KAF3IQ	Cliente Amazon	2019-02-13	5	0	True	Gioco veramente ben fatto, la lunga attesa é stata ripagata.
R1R2MC2B48IQBE	B00ESBHG3Q	Ottimo prodotto	AGU76UJH6VYZRQYYUJOF7CGT3GPA	Federico Mauro	2019-02-25	5	0	True	Capolavoro.
R37UAJ6NJKKWUI	B00ESBHG3Q	Fantastico!	AG57QD65W4VABS36BW2CRM6TWF4A	Roberti Giacomo	2019-01-29	5	1	True	Scrivo solo WOW
RB9XWQ5S4I5DG	B00ESBHG3Q	Entusiasma del figlio	AGTZDGVNLNJUWZSE7NRYZ5MPLRSQ	Riccardo	2019-02-25	5	0	True	Figlio contentissimo
R3TBFJEM42UA9K	B00ESBHG3Q	Top!!	AEQLD4O7EOT4FCQ3BOBDMBQDVOKA	Raffaele D'Avino	2019-02-15	5	0	True	Prodotto ben imballato...tempi di consegna rispettati e ottimo gioco😂...consigliato.
R12LA96ODZ1RGQ	B00ESBHG3Q	Tutto perfetto.	AER7Q2KMZKVM7RTJMVITX2N7RIKA	Claudio	2019-01-30	5	0	True	Spedizione puntuale e imballaggio impeccabile. Nulla da criticare! Consiglio!
R1TGJ3PSPD68JB	B00ESBHG3Q	Perfetto	AHTVNPDMVNARX5HDDEZLCA23AV5Q	Matteo	2019-02-01	5	0	True	Perfetto in tempistiche e condizioni.
R1WHMSN8IW0F2W	B00ESBHG3Q	Top	AHOL3THXTMXRZGXUNQLJ7YGUSSQQ	Cliente Goldie	2019-02-15	5	0	True	Arrivato al D1, consiglio il gioco solo per i fan della saga
R118F4I8M8RZO0	B00ESBHG3Q	Perfetto!!	AFOLW2TS2IKRDSF6B63GOQDVOHSA	Giuseppe	2019-02-04	5	0	True	Arrivato senza problemi al day one. Perfettamente funzionante. Perfetto!!
R353FHW7U2OUR3	B00ESBHG3Q	Un must have di primissima qualità per appassionati e non	AENWOH2YBE3QY7YNHVIKF3U2LYAA	Afadda-87	2019-03-30	5	0	True	Spettacolo puro. Per tutte le età
R2Y501R7DXWCW8	B00ESBHG3Q	Di un altro livello	AGK3PQHRADSJACHHVFB6PBKLF3EQ	Sebastiano Romano	2019-02-01	5	0	True	Aspettare più di 10 anni per giocarci, che cosa dire...stupendo
RNOLNK6BB3KU6	B00ESBHG3Q	Qualità e Precisione.	AFR6AP5MWOIWI3UIZSITGSIZO3ZA	Pasquale Di Sarno	2019-04-05	5	0	True	Prodotto fantastico, condizioni perfette, e tempi di consegna ottimi.
R96DQVEINOJ94	B00ESBHG3Q	Gioco bello ed entusiasmante. Rapporto prezzo qualità ottimo	AETJHU7452LFYVTMDIYWMPXEFOGA	MONICA	2019-03-17	5	0	True	Sempre al top!
R1HYYBV51QK4QN	B00ESBHG3Q	Perfetto	AGRXGWRF6I42NZJGQUDEVXH3HDIA	gabriele	2019-01-30	5	0	True	Consegna in 16h dall’ordine, gioco in ottime condizioni e sigillato
R5CI76BOCAI69	B00ESBHG3Q	Fantastico	AF6AXI4PREAYFPLXGNAL2WNHBVYA	Christian Di Florio	2019-02-25	5	0	True	Fantastico. Degna conclusione della saga di Xehanort
R23BLGXXFW5TR4	B00ESBHG3Q	gioca bellissimo	AFLC2J2SHBTRPCD6TYQ3HDLLCDDA	riccardo 	2019-02-15	5	0	True	gioco della madonna, me ne innamoro ogni giorno di piu'
R2K00SHBX69YVO	B00ESBHG3Q	Meraviglioso	AG2ASNEAAORZDBWOYBXKMXGXWTZA	Katriel	2019-01-29	5	0	True	Il titolo parla da sé
R2JTX350IU93VC	B00ESBHG3Q	Fantastico	AH2C7TSZ5MZGKVBO3IKVO2FEGEZA	giuseppe tancredi	2019-02-20	5	0	True	lo aspettavo da 10 anni finalmente!
RK92I4FRGXDMJ	B00ESBHG3Q	Mitico	AEID2J2UL37CRSYOW25WVZJQWABQ	Cliente Amazon	2019-02-23	5	0	True	Mitico dopo 13 anni finalmente....
R2NGY4WMD12PHN	B00ESBHG3Q	Capolavoro !!	AFBLR3C5GDVLLZKWM26IB3ZFB3UQ	Cliente Amazon	2019-02-24	5	0	True	Sicuramente Il miglior capitolo in assoluto !
R1A7E5UAZL3VMI	B00ESBHG3Q	Bello	AF5SPUMZ2TMR5AR3ZJVFRVDOAOQA	Andrea	2019-03-20	5	0	True	Bello
R2P39OTBVZA1PL	B00ESBHG3Q	Meraviglioso	AHFEDCLILJ45SUBU2TTISTQW7E7Q	Bianca Vietri	2019-02-19	5	0	True	Vale davvero la pena di comprarlo.
R28FBXVJZQTGAH	B00ESBHG3Q	Per PS4	AHIY6LDQ5TX5XCPHPCVXGFRQ3JOQ	Luciano	2019-03-02	5	0	True	Gioco molto bello
R28AB4WQJNKR41	B00ESBHG3Q	Ottimo	AFMTL6RL5CWOJOUFCYPKD4U6OT5A	Stefano	2019-02-09	5	0	True	Stupendo
R3OJ2AAO1M1BQW	B00ESBHG3Q	Consigliato	AFLDUUGHRWXECQVGKX2N75VZKPFQ	Stefano	2019-02-06	5	0	True	Spedizione veloce e puntuale.
R2O6AU7MLY0VKV	B00ESBHG3Q	Ok	AGYWWVW33OKKKF4OAGG37UTHVYGQ	Cliente Amazon	2019-03-20	5	0	True	Tutto ok
R2VWPCSZO1CNKE	B00ESBHG3Q	Spettacolare, imperdibile!	AGNPDY3C5KUNT7A3EMXF6WPU4FLA	Matteo	2019-02-18	5	0	True	L’attesa è stata ben ripagata.
R1IVKF3FQBWSCM	B00ESBHG3Q	Lacrime	AEVTJC4CYZBHSH5MRE6O6VLPX4ZA	Alberto Sta	2019-02-15	5	0	True	Capolavoro, gioco perfetto
ROUB3XK97I6R5	B00ESBHG3Q	Finalmente	AG2QASVK57ONZHFSCR5ATZO5IM4Q	Fallax	2019-02-15	5	0	True	Tanta roba
RDD6CNA67RAFV	B00ESBHG3Q	😍😍😍😍	AEUYDIPT3ZL6HQXXXKASQMC2LETA	Cliente Amazon	2019-02-22	5	0	True	Uno spettacolo.........
R2LTVKF40A8651	B00ESBHG3Q	Magico	AF7RPTYKSOMOMFKVUVWUQ6QBLEWQ	Julia	2019-03-12	5	0	True	Semplicemente magico.
RKYSBXK8QWLIQ	B00ESBHG3Q	Gran gioco	AEBLB7QSY6KESURL3LV46HOQ7ZPQ	AlbySG8	2019-02-22	5	0	True	Spettacolo
R17AXUE5XW928F	B00ESBHG3Q	Da non perdere	AEQ6B2T34YK6NNILHSKHG2J7REVQ	Vincenzo 	2019-02-27	5	0	True	Gioco fantastico!
R25T6Y0Z1UCF57	B00ESBHG3Q	Bellissimo	AGJH5J7CKYJEE5ZWAGD2FCZZQ4OA	Cliente Amazon	2019-02-15	5	0	True	Da comprare
R27G8HZ2S0L3KL	B00ESBHG3Q	Bellissimo	AEMZRXD6ZQOU2AWYLAD4HDNUG4DQ	Alberto	2019-02-15	5	0	True	Bellissimo
R3PE3MKCIXYJ2S	B00ESBHG3Q	Epico!	AHKCXQKR3P5RQXUATDAK3CPWNIWQ	SDavide91	2019-02-19	5	0	True	Epico!
RPP5TA7WTP854	B00ESBHG3Q	Lunga attesa ripagata?	AHXK5HC6JDESEAOPOGMZAOBF4EZA	L'animazione secondo Edo	2019-01-29	4	8	False	"Difficile valutazione di uno dei giochi più attesi negli ultimi 10 (e passa) anni.
Il primo capitolo uscì nel 2002, ne è passato di tempo, sono usciti vari capitoli, spin-off e compagnia bella, ma la cosa è un po’ sfuggita di mano direi.
Perchè direte voi? Perchè la trama si è arricchita così tanto da diventare addirittura difficile da seguire e ricordare, soprattutto perchè è cominciata ben DICIASSETTE ANNI FA. Quindi a conti fatti, vista la mole di contenuti narrativi e rimandi celati in KH3, consiglio vivamente a tutti di recuperare i capitoli precedenti (presenti anche su PS4). Perchè, seriamente, per apprezzare davvero la trama di quest’ultimo capitolo, dovete conoscere delle librate di roba, e tutto ciò diventa quasi tragicomico.
Per tutti coloro che sono preoccupati per la trama (inutilmente) arzigogolata, dico: non disperate! Perchè al di là della narrazione del titolo (paradossalmente l’aspetto meno riuscito), tutto il resto brilla, ma brilla così tanto da dover metter su gli occhiali da sole!
C’è tantissima Disney, ancora più che in passato, tirando fuori dal cilindro una grafica spaccamascella, un cartone animato che manco Oceania, ambienti meravigliosi e atmosfere letteralmente magiche; una gioia per tutti i bambini e per tantissimi grandi (che sono cresciuti magari col primo capitolo).
Le musiche sono tra le più belle mai presentate in un videogioco, le meccaniche prendono il buono dai capitoli precedenti (e fortunatamente anche dagli spin-off), ci sono decine e decine di minigiochi che spezzano (anche troppo) il ritmo di gioco, rendendo tutto molto più vario rispetto a qualche capitolo fa.
Il gioco è lungo, le prime 15-20 ore sono piuttosto lente, la difficoltà è tarata verso il basso (per i più navigati, consiglio di partire con difficile), quindi anche per i marmocchietti è un buon inizio.
In conclusione che dire: penso che questa saga sia stata tirata troppo per le lunghe, allungandone inutilmente il brodo e perdendo molto sotto il profilo narrativo.
Quindi le soluzioni sono tre: vi sparate tutta la saga e vi studiate tutto per filo e per segno, vi guardate un bel video riassuntivo, o vi godete questo spettacolo, passando sopra alla complicatissima storia e gustandovi i meravigliosi mondi riprodotti con cura certosina.
8.5/10"
R1ZA4S06RFP6YV	B00ESBHG3Q	Kingdom Hearts 3.	AG34JZRPPIXDT535OKSRSCOAQENQ	Lorenzo	2019-01-29	5	8	False	"Io ancora non ci credo di avercelo tra le mani, ma eccolo qui, Kingdom Hearts 3, la conclusione di un’avventura quasi ventennale è finalmente tra noi, nei negozi, online, pronto per essere acquistato e giocato. Ed è perfetto. Dal punto di vista grafico si è praticamente immersi al 100% nei propri film Disney e Pixar preferiti: Monsters & Co, Toy Story, Frozen, Rapunzel risplendono gloriosamente e poter esplorare liberamente mondi originali di Kingdom Hearts come Crepuscopoli o il Cimitero Dei Keyblade in tutta la loro maestosità è una sensazione fantastica. Il gameplay è a dir poco perfetto: vario, divertente, intuitivo, con possibilità infinite praticamente; Square Enix ha pensato bene di eliminare ciò che è meno piaciuto di tutti i capitoli (come la console dei comandi di Birth By Sleep e Dream Drop Distance) e di lasciare ciò che andava bene (ad esempio il fluimoto e soprattutto i miei amatissimi comandi di tiro); tantissimi attacchi combinati con i nostri eroi Disney e amici preferiti, armi intercambiabili e combinabili che rendono i combattimenti sempre avvincenti; Colonna sonora come sempre perfetta e azzeccata, con possibilità di controllare più personaggi… questo non è un gioco, è IL gioco. E non è che perché l'abbiamo aspettato tanto allora è bello per forza, no. È bello perché lo è davvero. Anni, anni di attesa finalmente ripagati.
Piccolo appunto: l’epilogo e il finale segreto necessitano di una connessione internet per essere scaricati (download che avverrà rispettivamente il 30 e 31 gennaio, per chi finisse il gioco entro queste date).
E ora basta ciance, si va a sconfiggere Xehanort e la sua Organizzazione XIII una volta per tutte (si spera!)"
RZDW0RMGKQ4CJ	B00ESBHG3Q	Giovani VS Adulti.	AH7676ISA652ORSBOFBDVBBMM4NA	cosepreziose	2019-02-16	4	1	False	"Così tanti anni passati dal secondo capitolo che ho perso un po' di quella magia nonostante la desiderosa attesa, e anche alcuni passaggi finiti nell'oblio della coscienza, al punto che sarà forse per l'età ma quando ho giocato l'ultima volta a KH risale circa a nove anni fa, ebbene cambiano tante cose crescendo ricordando quando fui un 24 enne un sacco di tempo a disposizione e gli amici all'oratorio insieme tra pomeriggi e serate ed essere oggi un 33enne con il peso delle responsabilità di un giovane adulto ed un tempo limitato. Non me la sento di riprendere in mano i capitoli precedenti, ed ovviamente il coinvolgimento è per natura inferiore.
La meccanica di gioco è sempre quella, la difficoltà invece qualcosina di più facile.
C'è stato un grande hype giocando sulla nostalgia, il prezzo di lancio per me esagerato,"
R1MEFOS1TZT92Z	B00ESBHG3Q	Kingdom Hearts 3: capolinea della grande epopea Square e Disney	AGIAXIKLHSMAUVPFDRYHKQFVTYTQ	Matteo Pugliese	2019-02-02	5	0	False	"La strada che ci ha condotti a Kingdom Hearts III è stata lunga e tortuosa, anche “grazie” alla maniacale cura che Tetsuya Nomura aveva riposto nella scrittura dei suoi molti prologhi. Dopo tredici anni trascorsi a preparare con estrema calma e dedizione quello che doveva rappresentare la summa del suo aggrovigliato immaginario, Nomura preme il piede sull'acceleratore ad un solo passo dal traguardo tanto ambito, facendo moltissime concessioni al fanservice e componendo un tessuto narrativo che non ha saputo soddisfarci interamente. Ciononostante, l’entusiasmante rilettura dei nostalgici mondi Disney, unita ai considerevoli progressi compiuti sul fronte ludico e artistico, permette a Kingdom Hearts III di arginare i punti oscuri dell'intreccio principale con l'indiscutibile bontà dell’ultimo viaggio di Sora. Il cuore pulsate del prodotto è infatti rappresentato anche dai vagabondaggi dell’eroe attraverso le brillanti licenze Disney e Pixar, capaci di sorreggere e impreziosire un affresco sì indubbiamente epico ma anche imperfetto, ferito dagli ingranaggi del tempo. Se aggiungiamo alla ricetta un combat system frenetico e coinvolgente, il risultato finale, in cui si mescolano le due anime del crossover, assume quindi un sapore piacevolmente agrodolce.
La cosa più importante, tuttavia, è che Kingdom Hearts III chiude il cerchio con un finale soddisfacente e più risposte che domande. I fan che lo hanno atteso per tutto questo tempo non resteranno assolutamente delusi.

PRO
Visivamente maestoso e curato, spettacolare e ricco di dettagli
Nomura chiude quasi ogni sottotrama in sospeso
Tanti contenuti secondari che estendono la longevità

CONTRO
Telecamera discutibile
La colonna sonora di Shimomura nei mondi Disney è decisamente la meno memorabile
Componente GDR piuttosto blanda"
R30D6MVA1VRXPT	B00ESBHG3Q	Gameplay di 20 anni fa Noiosissimo...	AF5LMS6CZIUUB5554AK3P5HRSLAQ	Kakashi	2019-02-25	1	3	False	La storia annoia parecchio, gameplay vecchissimo di 20 anni fa e che non ti viene nemmeno la voglia di giocarci per quanto è ripetitivo.
R137ODOO2KO0W4	B00ESBHG3Q	I pianti.	AHM2A7BVNO2OGRPESTN7VX43ZXQA	Francesca Pantaleone	2019-03-30	5	0	False	I pianti, quelli belli. Avevo iniziato questa saga che avevo 12 anni: proprio come KH1, avevo una concezione del mondo più semplicistica, oscurità e luce, male e bene, che si sconfiggono e combattono l'un l'altro; ma c'è oscurità dentro la luce e viceversa. Mi viene da dire che questo gioco sia cresciuto con me: ho 26 anni ora, e ci sono così tante sfumature che questo gioco mi ha dato, così tante emozioni complesse e nostalgiche.  È stato bellissimo fare amicizia con nuovi personaggi Disney, e rivedere vecchi amici. Il finale (no spoiler) mi ha fatto piangere. Chi non si è emozionato dopo 10 anni di attesa non ha capito il vero senso di questo gioco, la vera storia , che solo Nomura sa dare. All'inizio è lento, ma alla fine è veloce, anche troppo, ti catapulta dentro e non riesci neanche a respirare. Grazie per questo gioco. Grazie Nomura.
R3QINPRJYTZ8IK	B00ESBHG3Q	Comprato direttamente sul sito del Fornitore	AGZ4DQCCOPXPEU56BDF7A2XJUDFQ	Cliente Amazon	2019-03-15	5	0	False	"Bisogna essere fan di vecchia data per recensire correttamente questo prodotto ed io lo sono. Premetto che KH3 è sicuramente più semplice da completare rispetto ai capitoli precedenti della saga (prequel e midquel), meno complesso di quanto noi fan potessimo immaginare. La trama conclude perfettamente la saga del Maestro Xehanort aprendosi perfettamente a nuovi scenari. La grafica è eccezionale, nulla da dire. Il sistema di gioco, a mio avviso, presenta (forse) qualche piccola pecca che poteva (forse) essere corretta: sono un perfezionista e guardo anche i piccoli dettagli, quelli quasi del tutto invisibili. In ogni caso il gioco è fedele al suo essere, altrimenti non staremo qui a parlare di Kingdom Hearts, ragion per cui mi sembra del tutto sbagliato criticare questo gioco per le molte sequenze video o per i ""troppi"" mondi Disney o Pixar o per la presenza di personaggi quali Paperino, Pippo e Company."
R2M6D79IZ4HEE	B00ESBHG3Q	Kingdom hearts 3!!!	AHBQ27B4YW2PMKJZTJLALKBATF2Q	Antonio	2019-01-31	5	0	False	Beh, che dire... è il kingdom hearts che tutti i fan si aspettavano, la degna conclusione dell’arco narrativo di Xehanort! Eccezionale sotto (quasi) ogni punto di vista. Il sistema di combattimento è lo stesso a cui ci ha abituato da sempre ma con parecchi miglioramenti, i mondi, chi più chi meno, sono tutti creati con molta cura ( rispetto ai precedenti kh si è fatto un balzo in avanti notevole per quanto riguarda il level design dei mondi), graficamente molto bello da vedere. Le sole pecche che ho trovato sono la telecamera, spesso mal gestita durante i combattimenti, e la difficoltà tarata verso il basso (anche se il gioco offre diversi espedienti per rendere il gioco più ostico).
